{
  "session_id": "550e8400-e29b-41d4-a716-446655440000",
  "generated_at": "2026-01-07T10:47:23Z",
  "decisions": [
    {
      "decision_id": "decision-001",
      "timestamp": "2026-01-07T10:05:12Z",
      "category": "tech_stack",
      "phase": "plan",
      "decision": "Use Passport.js for OAuth authentication",
      "rationale": "Passport.js is already a dependency in package.json, has excellent OAuth provider support, and is widely adopted in the Node.js ecosystem. It integrates well with our existing Express middleware.",
      "alternatives_considered": [
        {
          "option": "Implement OAuth flow manually",
          "reason_rejected": "Would require significant development time and maintenance burden. Passport provides battle-tested implementations."
        },
        {
          "option": "Use auth0 SDK",
          "reason_rejected": "Vendor lock-in concerns and additional service dependency not needed for our use case."
        }
      ],
      "context": {
        "sources": [
          "package.json analysis",
          "codebase grep for 'passport'",
          "npm registry statistics"
        ],
        "confidence": "high"
      },
      "impact": {
        "scope": "session",
        "risk_level": "low",
        "reversibility": "moderate"
      }
    },
    {
      "decision_id": "decision-002",
      "timestamp": "2026-01-07T10:05:45Z",
      "category": "tech_stack",
      "phase": "plan",
      "decision": "Store sessions in PostgreSQL using connect-pg-simple",
      "rationale": "Project already uses PostgreSQL for data persistence. Reusing existing database infrastructure avoids introducing new technology. connect-pg-simple is mature and well-maintained.",
      "alternatives_considered": [
        {
          "option": "Redis for session storage",
          "reason_rejected": "Would require additional infrastructure. Not justified given our session volume requirements."
        },
        {
          "option": "In-memory sessions",
          "reason_rejected": "Not suitable for production deployment with multiple processes."
        }
      ],
      "context": {
        "sources": [
          "Existing database configuration",
          "Scalability requirements analysis"
        ],
        "confidence": "high"
      },
      "impact": {
        "scope": "codebase",
        "risk_level": "medium",
        "reversibility": "moderate"
      }
    },
    {
      "decision_id": "decision-003",
      "timestamp": "2026-01-07T10:08:23Z",
      "category": "architecture",
      "phase": "plan",
      "decision": "Implement middleware-based authentication flow",
      "rationale": "Matches existing authentication patterns in the codebase. Express middleware pattern is consistent with current architecture. Allows for easy composition of auth logic.",
      "alternatives_considered": [
        {
          "option": "Controller-based auth",
          "reason_rejected": "Would require refactoring existing middleware patterns. Less flexible for route-level auth variations."
        }
      ],
      "context": {
        "sources": [
          "Existing auth middleware analysis",
          "Route structure review"
        ],
        "confidence": "high"
      },
      "impact": {
        "scope": "codebase",
        "risk_level": "low",
        "reversibility": "easy"
      }
    },
    {
      "decision_id": "decision-004",
      "timestamp": "2026-01-07T10:12:07Z",
      "category": "task_ordering",
      "phase": "generate_tasks",
      "decision": "Order tasks: database schema first, then backend routes, then frontend UI, then testing",
      "rationale": "Foundational database schema must exist before any data access. Backend routes define API contract that frontend depends on. Frontend can be built in parallel with backend. Testing must come after implementation.",
      "alternatives_considered": [
        {
          "option": "Frontend first with mock data",
          "reason_rejected": "Would require refactoring when real API is available. Higher integration risk."
        }
      ],
      "context": {
        "sources": [
          "Dependency graph analysis",
          "Task complexity assessment"
        ],
        "confidence": "high"
      },
      "impact": {
        "scope": "session",
        "risk_level": "low",
        "reversibility": "easy"
      }
    },
    {
      "decision_id": "decision-005",
      "timestamp": "2026-01-07T10:25:18Z",
      "category": "error_recovery",
      "phase": "implement",
      "decision": "Fix failing test by updating test fixture instead of production code",
      "rationale": "Test fixture was using incorrect data format. Production code implementation was correct. Updating fixture aligns test with expected API behavior.",
      "context": {
        "sources": [
          "Test failure analysis",
          "Code review of implementation"
        ],
        "confidence": "high"
      },
      "impact": {
        "scope": "task",
        "risk_level": "low",
        "reversibility": "easy"
      }
    },
    {
      "decision_id": "decision-006",
      "timestamp": "2026-01-07T10:35:42Z",
      "category": "subagent_delegation",
      "phase": "implement",
      "decision": "Delegate OAuth UI component to frontend-developer subagent",
      "rationale": "Task requires React expertise and UX considerations. Frontend-developer has specialized skills in component design and state management.",
      "context": {
        "sources": [
          "Task categorization",
          "Subagent capability matrix"
        ],
        "confidence": "high"
      },
      "impact": {
        "scope": "task",
        "risk_level": "low",
        "reversibility": "moderate"
      }
    },
    {
      "decision_id": "decision-007",
      "timestamp": "2026-01-07T10:42:15Z",
      "category": "checkpoint",
      "phase": "implement",
      "decision": "Create git checkpoint after all OAuth backend routes completed",
      "rationale": "Backend OAuth implementation is complete and tested. Safe checkpoint point allows rollback if frontend integration encounters issues. All tests passing.",
      "context": {
        "sources": [
          "Test suite results",
          "Task completion status"
        ],
        "confidence": "high"
      },
      "impact": {
        "scope": "session",
        "risk_level": "low",
        "reversibility": "easy"
      }
    },
    {
      "decision_id": "decision-008",
      "timestamp": "2026-01-07T10:47:00Z",
      "category": "validation",
      "phase": "validate",
      "decision": "Approve implementation for handoff",
      "rationale": "All 127 tests passing. All 8 PRD requirements met. Quality gates passed (ESLint, TypeScript, security audit). Code review shows clean implementation following existing patterns.",
      "context": {
        "sources": [
          "Test results",
          "PRD requirement checklist",
          "Quality gate reports"
        ],
        "confidence": "high"
      },
      "impact": {
        "scope": "session",
        "risk_level": "low",
        "reversibility": "moderate"
      }
    }
  ],
  "summary": {
    "total_decisions": 8,
    "decisions_by_category": {
      "tech_stack": 2,
      "architecture": 1,
      "task_ordering": 1,
      "error_recovery": 1,
      "subagent_delegation": 1,
      "checkpoint": 1,
      "validation": 1
    },
    "high_confidence_decisions": 8,
    "high_risk_decisions": 0
  }
}
