{
  "session_id": "b74b3cd6-52e4-48dd-8e53-a4308592659e",
  "generated_at": "2026-01-07T13:02:32.174149+00:00",
  "decisions": [
    {
      "decision_id": "decision-001",
      "timestamp": "2026-01-07T13:02:32.174218+00:00",
      "category": "tech_stack",
      "decision": "Use FastAPI for REST API backend",
      "rationale": "Modern async framework with automatic OpenAPI generation, built-in validation, and excellent performance",
      "phase": "plan",
      "alternatives_considered": [
        {
          "option": "Flask",
          "reason_rejected": "Requires additional libraries for async and validation"
        },
        {
          "option": "Django REST Framework",
          "reason_rejected": "Heavier weight than needed for this service"
        }
      ],
      "context": {
        "confidence": "high",
        "sources": [
          "FastAPI documentation",
          "Benchmark comparisons"
        ],
        "choice": "FastAPI",
        "category": "framework",
        "ecosystem_maturity": "stable",
        "community_size": "large"
      },
      "impact": {
        "scope": "codebase",
        "risk_level": "low",
        "reversibility": "moderate"
      }
    },
    {
      "decision_id": "decision-002",
      "timestamp": "2026-01-07T13:02:32.174385+00:00",
      "category": "tech_stack",
      "decision": "Use PostgreSQL as primary database",
      "rationale": "ACID compliance required for transactions, complex query support needed, and existing team expertise",
      "phase": "plan",
      "alternatives_considered": [
        {
          "option": "MongoDB",
          "reason_rejected": "Relational data model\u66f4\u9002\u5408"
        },
        {
          "option": "MySQL",
          "reason_rejected": "PostgreSQL has better JSON support and advanced features"
        }
      ],
      "context": {
        "confidence": "high",
        "choice": "PostgreSQL",
        "category": "database",
        "performance_requirements": "High"
      },
      "impact": {
        "scope": "codebase",
        "risk_level": "medium",
        "reversibility": "difficult"
      }
    },
    {
      "decision_id": "decision-003",
      "timestamp": "2026-01-07T13:02:32.174585+00:00",
      "category": "architecture",
      "decision": "Implement Repository pattern for data access",
      "rationale": "Separates business logic from data access logic, makes testing easier, and provides flexibility for data sources",
      "phase": "plan",
      "alternatives_considered": [
        {
          "option": "Active Record pattern",
          "reason_rejected": "Tight coupling between domain and data models"
        },
        {
          "option": "Data Mapper pattern",
          "reason_rejected": "Additional complexity not needed at this stage"
        }
      ],
      "context": {
        "confidence": "high",
        "existing_patterns": true,
        "consistency_with_codebase": "matches",
        "complexity_level": "moderate"
      },
      "impact": {
        "scope": "codebase",
        "risk_level": "low",
        "reversibility": "moderate"
      }
    }
  ],
  "summary": {
    "total_decisions": 3,
    "decisions_by_category": {
      "tech_stack": 2,
      "architecture": 1
    },
    "high_confidence_decisions": 3,
    "high_risk_decisions": 0
  }
}